{"$schema":"https://json-schema.org/draft/2020-12/schema","type":"object","additionalProperties":false,"required":["schema","proofSystem","toolchain","mathlibRevision","buildCommand","trustedStatementPath","solutionPath","declaration","artifactSha256"],"properties":{"schema":{"const":"riemann-lab.verification-manifest.v1"},"proofSystem":{"const":"lean4"},"toolchain":{"type":"string"},"mathlibRevision":{"type":"string"},"buildCommand":{"const":"lake build"},"trustedStatementPath":{"type":"string"},"solutionPath":{"type":"string"},"declaration":{"type":"string"},"artifactSha256":{"type":"string","pattern":"^[a-f0-9]{64}$"}}}
